2023-09-01,anak buah lagi terangin bukan jualan bosnya yang bikin polusi.,"Mantab jakarta , tumpuklah tanpa henti kabut asapnya ya sehingga akhirnya nanti kebingungan akan kalian nikmati good job",Karena tidak adanya hujan karena hujan bisa membersihkan udara,ada yg belum dimasukkan daftar polusi dari pembalakan liar dengan pembakaran hutan yang marak terjadi di Kalimantan dan Sumatra dan juga penggundulan hutan yang disebabkan oleh pembangunan IKN,TERNYATA MOBIL LISTRIK MEMBUAT POLUSI TMBAH PARAH,"Waktu pandemi covid saya jarang bgt kena flu, dan saya tidak pernah kena covid. Sekarang polusi jakarta lagi parah, saya kena ispa bulan lalu, sembuh dan sekarang kena ispa lagi. padahal di luar ruangan selalu pakai masker.",Apakah dengan ASN mencicil mobil listrik menjadi solusi mengurangi polusi di DKI. Ha ha ha ha ha LUCU banget,,,,,,,,,,,,,,,,,,,,,,,,,,,,,,,,,,,,,,,,,,,,,,,,,,,,,,,,
2023-09-02,"Kadar polusi dikota mungkin biasa saja, ak kadang pakai masker klu aktivitas tuk jaga kesehatan. Bca sholawat dalam hati klu ada waktu agar polusinya dibawa angin. Seumpama sulit tidur bca Allahulaaaaailla haillahuwaalhayyul qoyyumlatakhudu husinatuwwalaanaum berulang2 sampai tertidur, tetanggaku tidak mau bca awal ayat Kursi itu saat sulit tidur saat meninggalnya tidak baik","transport memang harus uji emisi , ngaco bgt emang jkt itu gak ada uji emisi. malu lah punya motor tp bikin polusi","Udah parah baru ribut , mau mulai dari mana untuk perbaiki kwlitas udara jakarta semakin pusing , akibat ganti pejabat ganti aturan ngak punya kebijakan 100 thn kedepan, cukup 5 thn biar penggantinya yang mikir begitu seterusnya",saya yakin polusi jakarta ada yg bikin. dlu dlu g pernah kek gini. ada yg nyumbang asap nih untuk tujuan tertentu. harusnya di cari dr atas brgkali ada penghasil asap yg tdk diketahui oleh kebanyakan orang yang memghasilkan asap yg sukar hilang.,"Saya rasa penerapan ini sangat tidak efektif sekali menggunakan aturan -aturan sistem penilangan cuma hanya berdasarksn polusi di kota jakarta... kan bisa menggunakan pesawat sama helikopter tinggal disiram dari udara ibaratnya bikin hujan buatan seperti dinegara-negara lain amerika,kanada,unisoviet,dan rusia.. kok pemerintah indonesia malas sekali menerapkan aturan-aturan seperti itu nggk kayak dinegara-negara lain...enak banget ngasih aturan penilangan cuma hanya berdasarkan polusi udara.. ini jgn-jgn polisinya ujung-ujungnya bisa mendapatkan duit yg banyak hanya dikarenakan gagal emisi disebabkan polusi udara hahaha pabrik-pabrik,pltu dirazia polisi ndak haha... negara indonesia penuh mata duitan kabehhh kerjane ogah-ogahan haha.....","Pembangunan yg tdk merata. Jakarta dibangun terus, modernisasi mengundang rakyat kumpul ke Jakarta. Penuh sesak shg menimpulkan masalah termasuk polusi. Sampai solusi ditemukan NIKMATI SAJA",Asap nya di arah kan ke air aja,Itu mah bukan polusi lagi,Ternyata polusi Jakarta sudah pernah diulas narasi 1 thn lalu,"demi kenyangnya perut, udara jakarta jadi carut marut","Kesini gara2 jakarta polusi udah parah bgt , Sumber polusi jga katanya dari batu bara !",Yaampun sdh 1 tahun yg lalu dan sekarang polusi di jkt polusi bget skitar jabar jugaa,wah algoritma youtube keren jg. ini video setahun lalu dan skrg masih jadi issue. bahkan lebih parah. bukti bahwa pemeritah.. emang hilang arah dan kadang gegabah. akhir nya polusi meraja relah. sudah lelah dan pasrah,"solusi polusi udara PNS WFH awkwowkwowkwowk kocaaakkkkkkk bgt, ini pabrik salah satu penyumbang polusi ga bakal berani disentuh karena ada money yg mengalir",Koq muncul di beranda di Sept 2023. Kaya ada yg menghubungkan dengan polusi jakarta saat ini yaaaa.....,,,,,,,,,,,,,,,,,,,,,,,,,,,,,,,,,,,,,,,,,,,,,,,,
2023-09-03,"Ini angin musim barat...cek deh pake anemometer...semua pltu dekat jakarta ada di banten dan angin nya ke barat bu....jakarta kan sebelah timur...hhmmm....pltu stack cerobong asap sudah dilengkapi penangkap debu dan selalu di cek oleh bagian k3 serta dinas lingkungan hidup...coba kita cermati...pas covid langit jakarta bagus dan cerah banget...polusi menurun drastis....lagi musim kemarau seperti sekarang dan pltu masih tetep beroperasi.....coba cek yuk emisi kendaraan bermotor kita masing masing, ditambah sama debu yang karena ngg ada hujan jadi bertebaran di udara...belum lagi pabrik pabrik...yuk berfikir cerdas....",Lawan arus aja susah di tertipkan apalagi polusi,"Jakarta kurang pohon sebagai penghijauan di pinggir jalan, trotoar lebar tapi gak ada pohon yg ada tiang JPO n gedung wajar kalo polusi udara","Pertanyaannya, sebelum pandemi pun pengguna kendaraan bermotor sama banyaknya, bahkan blm ada yg pakai kendaraan listrik. Tapi kok ga ada tuh kabut polusi sampai setebal ini? Kok ya bs tiba2 dlm bbrp hari langit jakarta sampai begitu? Jawabannya karna kemarau panjang. Ga ada hujan yg membersihkan debu diudara. Ditambah lg polusi juga berasal dari industri2 dan kendaraan di kota penyangga. Lah kok bisa cuma ribut polusi di jakarta? Apa kabar depok, tangerang, bekasi, yg sama parah macet dan polusinya?",Bisa gak Kominfo dan KLHK jgn SMS nya gini2 Jangan lakukan kegiatan yang menyebabkan kebakaran hutan/lahan dan menimbulkan kabut asap. Hindari lokasi terbakar dan patuhi arahan petugas. KLHK-Kominfo. --------- Tapi ganti redaksi ...berani?,"Polusi di jakarta, bukan karena asap kendaraan bermotor. Tapi akibat ulah KERAKUSAN mafia mafia energi batubara, yang mengelilingi Presiden Jkw, dan sudah mengatur kebijakan pengelolaan energi nasional. Para taipan batubara ini sudah mengatur kebijakan pengelolaan sumberday energi nasional, hanya karena KERAKUSAN UANG dan kekuasaan..","Tinggal lapor ke Pemerintah atau presiden langsung kalau dalam pengelolaannya ada yang salah oleh pemegang proyek batu bara. tapi ada yang perlu diperhatikan juga faktor yang lain kemacetan yang mengahasilkan polusi udara, yang solusinya melakukan pengujian emisi( tindakan yang percuma) apa tidak dipikirkan melebarkan jalan agar kemacetan berkurang ...macet membuat polusi asap makin besar. Malah dibagun jalan speda dan bangku2 taman yang gak sekiranya penting.Pemimpin jakarta yang penuh rekam jejak itu hebat, Pohon monas dibongkar buat balap mobil, pohon2 disulap jadi pohon plastik.Bagaimana udara menjadi lebih baik?. jadi banyak hal yang harus diperhatikan juga.Kritik perlu tapi kritik yang memang benar ada dan bijak,agar semua menjadi lebih baik.","Mata Najwa sudah bahas tahun lalu , viral nya baru Juli 2023, bisnis listrik batubara. Bisnis kendaraan listrik malah lebih berpolusi",Kabarnya sampai sekarang udara jakarta masih dalam kondisi yg menyedihkan,Dan setahun kemudian sekarang 2023 jakarta polusi parah,Ini satu tahun lalu. Masih dan sangat valid saat ini. Tahun lalu hanya warga Marunda yg terdampak. Saat ini satu Jakarta terdampak,Main2 ke sumatera selatan kota Palembang dan Tanjung Enim deh. Debu dan limbah batu bara nya luar biasa,,,,,,,,,,,,,,,,,,,,,,,,,,,,,,,,,,,,,,,,,,,,,,,,,,,
2023-09-04,"coba modal dikit media, terbang keliling liat dari mana asal asul asap nya coba.. yg fair, jgn lupa videoin bukti nya, jgn takut utk jujur.","Kebanyakan orang berpikir polusi udara akibat pencemaran setempat, padahal bumi berputar 30 km perdetik, jadi siapa penyebabnya...?",kondisi polusi udara pencemaran siapa...? sedangkan bumi berpurat perdetik 30 km....,Pabrik kendaraan gak mau bangkrut..pokoknya buat trus,"sibuk salahkn sana sini, pdhl kmudahan pembelian kndraan itu dr siapa kbijakanx ... Ad uang skian ratus ribu DP motor bw plg motor baru, skrng anak marak pake motor di jalanan bhkn di jdikn mainan utk balap n ... Udh macet, polusi bru bgung sndiri,. Konoha realitanya",POLUSI POLITIK ILUSI/USIL,"masalahnya kalau pake batubara mau pake apa? tenaga surya dan angin ga bakal cukup. energi paling aman nuclear fusion Dan belum ada yg berhasil, tenaga nuklir sekarang ini juga menghasilkan limbah yg jauh lebih parah. Mobil listrik aja buah simalakama, makin banyak Mobil listrik berarti makin banyak batubara yg perlu dibakar karena casnya pake listrik kan? belum lagi harus nambang nickel, bauksit, lithium dll Dan batre bekasnya lon bisa didaur ulang. clean energy cuma nuclear fusion, sampai saat ini yg paling suskses baru china lewat matahari buatannya, Selama ini belum berhasil yah belum ada solusi untuk clean energy, kexuali yah balik aja ke jaman naik kuda.",Video ini tiba muncul saat polusi Jakarta sedang tinggi nya Apakah ini tanda klo penyebab polusi ?,Ada bukti bahwa pengerjaan sesuai SOP. Bukti berupa dokumen dan foto bisa dimanipulasi. Bisa saja fotonya baru difoto hari itu. Hari berikut2nya tidak dijalankan. Udah jelas itu temuan debu bergunung2 di rusun.,Kami yg di jakarta utara teluk gong terasa bangat,"Mau dilema tapi gimana listrik di indo hampir semuanya pake batubara, selain lebih mudah murah daya yg dihasilkan juga gedhe tapi ya itu emisi harus dipikirkan kerusakan lingkungan yg dihasilkan, hanya ada satu metode penghasil listrik yg menyamai PLTU Batu bara yaitu Nuklir, mau matahari angin panas bumi air belum mampu menyamai nuklir terlalu beresiko di indo soalnya rawan gempa juga, jadi dilema juga","Itu nasib yg jauh dari dampaknya, gimna yg bekerja tiap hari sampai seluruh badanya hitam kena debunya. Perlindungan pekerja dibidang tersebut juga butuh perlindungan.",,,,,,,,,,,,,,,,,,,,,,,,,,,,,,,,,,,,,,,,,,,,,,,,,,,
2023-09-05,Lah itu pabrik dah di tutup ap gk itikad baik,"manusia nya terlalu banyak, covid belum efektif mengurangi populasi orang di jakarta","Bener dong, sekarang jakarta masalah polusi, cuma sekarang solusinya hanya pembatasan kendaraan, padahal lebih dari itu","this was an investigation from a year ago.. salam dari 2023, jabodetabek pada kena ispa karena polusi..","fix ini sih yang salah angin, sama seperti kasus kanjuruhan",Up penyebab polusi,"pernah gue pKL PRAKTEK KERJA LAPANGAN di salah satu sekolah smk dekat dengan pertambangan pasir. ebuset baru selesai bersihin 10 menit langsung kotor lagi kata pembimbing udah kamu bersih pas pagi sama sore aja. untungnya gue gk punya alergi sinus. pKL slama 3bulan aja lumayan lah polusi debunya. bukit dikerukin, entah dijual kemana itu tanah sama pasir.",polusi krn pltu tp pemerintah suruh org ganti pake mobil listrik. sama ajak sakit pala tp di kasi obat sakit pinggang,Pabrik2 londry yang masih menggunakan batu bara di daerah kampung baru kebon jeruk sukabumi selatan jakarta barat masih melang lang buana...tak perduli kesehatan warga sekitar,"Udara jakarta lg buruk, ini muncul di FYP",,,,,,,,,,,,,,,,,,,,,,,,,,,,,,,,,,,,,,,,,,,,,,,,,,,,,
2023-09-06,"Halahhh luhut cs dari dulu klo ada masalah besar cuma bisa menuding sana sini , dari masalah batubara, sawit , covid sampe polusi ... beresin dan benahi dong ggg...kalian cuma koar koar bongkar2 tapi gak ada action yg solutif dan efectif ...",Setelah polisi nya sampe jakarta baru mulai ribut. Typical,PENYEBAB UTAMA BURUKNYA UDARA DI JAKARTA.. OH JADI INI BIANG MASALAH Y. knp yg disalahin kendaraan?! hahaha,Pengen gak ada polusi? Jangan ada kegiatan.. di rumah saja..! Mati lampu karena tdk ada bahan bakar? Biarin aja..! Yg penting tdk ada polusi..,"Ngomongin isu polusi batubara? Kurang tepat rasanya kalau seakan menyalahkan pihak pemerintah dan pengusaha saja. Demand akan listrik sangat berpengaruh dari tingkat pertumbuhan populasi manusianya. Kebutuhan akan energi listrik yang terus meningkat secara cepat dengan sangat terpaksa menggunakan energi alternatif tercepat dalam produksi listrik. Ini bukan masalah yang menjadi bom dalam sehari, sudah dirakit berpuluh-puluh tahun lamanya. Kebiasaan ketika masih status anak muda ingin merantau ke area ibukota, memutuskan berkeluarga dan tetap tinggal di ibukota menjadikan kebutuhan listrik menjadi semakin banyak. Manusia cuman bisa menyalahkan pemerintah dan pengusaha sekarang. Ibarat bom yang meledak, kita yang merakit, tetapi ketika sudah meledak kita tinggal menyalahkan pihak keamanan terkait dan supplier bahan bakunya. Begitulah manusia.","asap drmn tp yg di salahin kendaraan, banyak orang yang belum sempat uji emisi kena tilang.",,,,,,,,,,,,,,,,,,,,,,,,,,,,,,,,,,,,,,,,,,,,,,,,,,,,,,,,,
2023-09-07,"Batubara opung luhut emang paling bener dah, tokcer lah Ga mungkin bikin polusi","Ini biasa skrg jaman media gmpg bikin opini, aneh tiba2 ngmgin polusi udara syutingnya pas pagi saat emg berkabut dan yg disalain kendaraan polusi mw ad suru pake masker pengurangan kendaraan,4in1 24jam,pertalite mw diilangin.udh jelas aneh tiba2 ngangkat tema polusi lgs massive dlm bbrp hr tp ga sedikitpun menyalahkan industri2 yg asepnya luar biasa.",Ini loh yang bikin polusi di jakarta,Saya datang dari masa depan dan mengabarkan bahwa jakarta hari ini adalah kota dengan polusi tertinggi,Awokawokawok yg bikin polusi siapa yg motor ditilang siapa,Yap..uji emisi gas buang cerobong asap horisontal sudah berhasil direalisasikan ..kini tinggal menunggu giliran uji emisi gas buang cerobong asap vertikal,,,,,,,,,,,,,,,,,,,,,,,,,,,,,,,,,,,,,,,,,,,,,,,,,,,,,,,,,
2023-09-08,"Jd gini ni saya punya rmh d jakarta, tp macet,biaya hidup mahal,polusi pindah rmh lah k yg lebih baik yg ga macet,biaya hidup lebih murah, ga polusi, lap kerja masih bnyak dihitung2 biaya pindah rmh lebih murah dibandingin perbaiki macet,hemat2, dah naik kendaraan umum, eh tetangga yg lain tetep pke pribadi,hemat listrik eh yg lain tetep boros, kan capek mending pindah. Diatas jd solusi tuh yg jd masalah adalah Ini contoh kasusnya rmh pribadi tp kalo ibukota?biaya gede guys? Tp kalo gini c enak eh guys w mau pindah rmh nih, tp buat biaya pindah rmh,beli rmh baru,renovasi rmh w mau open donasi nih, atau nanti w talangin dlu pake uang w, sbagian mungkin w ngutang dlu tp ntar kalian tolong bantu bayar cicilannya ya. Soalnya lu ngerti kan uang w jg terbatas gmna? Jd masalah juga nanti kalo yg berpikir pindah rmh bnyak, apakah puncak skrg jd lebih asri adem setelah bnyak villa2d puncak?",Jadi bener dong 2050 Jakarta hancur kasih zombie sekalian aja eitss jangan lupa ditembok dulu,konyol banget bukannya di sedot polusinya... malah di seemburin air cemerlang sekali bapaaaak,"CUKONG BBM BKIN PROPAGANDA PLTU YG BKIN POLUSI DAN GBLKNYA SDM RENDAH PRCAYA PDHL 90% KRNA KNALPOT....LOGIKA AJA WKTU PNDEMI PLTU TTP OPRASI NYATANYA MLH BKIN LANGIT BIRU TUH, DAN KLO KRNA PLTU, PAITON SBG PLTU TRBSAR JD DAERAH PLING POLUSI...",Keren sekali mba nana..kupas tuntas masalah polusi,Pak jokowi maukah kesini? Narasi topik sumber polusi di jakarta yg non transportasi dgn fakta2 yg akurat,"Ingat ya,ini belum lagi kalo produksi batrey Mobil listrik,yg limbah Dan polusi udaranya lebih jahat Dan parah","Ngomong-ngomong soal pencemaran udara karena baru bara, kyaknya mba nana perlu ke kecamatan merapi, kab. Lahat, SUMSEL. Udah berpuluh kali protes dalam bentuk demo penutupan jalan/kantor batu bara akibat jalan rusak dan polusi udara. Ttp ga digubris. Nampaknya mungkin Ada politik juga disitu.. Mungkin Yaa","Nah ini baru bener smua y jgn lhat satu sisi dr kendaraan mbil pribadi , coba it kemenhub dan kementrian industri dan lingkungan liat dan periksa it pbrik batubara ada ijin ya gk dan sesuai tidak dngan sop lingkungan hdup ...ini asap byk polusi byk slahkan mbil pribadi saja , truk dan pbrik di merunda it byk yg nakal",Polusi dari ini,STOP BATU BARA... dan biarkan jakarta kekurangan listrik.. entar juga demo lagi tuh.. Jakarta gak ada listrik kalau gak pake batu bara.. ujung nya ambil listrik dr daerah lain..,,,,,,,,,,,,,,,,,,,,,,,,,,,,,,,,,,,,,,,,,,,,,,,,,,,,
2023-09-09,Suatu saat nafas di Jakarta bakal bayar,Selain polusi juga sudah terciium bau2.. Bau bau penghianatan,,,,,,,,,,,,,,,,,,,,,,,,,,,,,,,,,,,,,,,,,,,,,,,,,,,,,,,,,,,,,
2023-09-10,"Yaampun masalahnya udh bertahun2 ternyata ya, di up tiap taun atau gmn ya masalah polusi ini. Ga beres2. Sedih",Knp ga di pulau seribu yang tak berpenghuni .. kan banyak pulau kosong gitu.. polusi pekat di jakarta kyanya dr batu bara ini nih.. plus emisi juga.. sejak kapan ya listrik tenaga batubara ini beroperasi,Bahkan sebelum polusi jakarta kian banyak team mata najwa sudah dulu sadar akan hal ini ..,"Salut dgn suku dinas lingkungan hidup yg terus mendorong agar lbh baik, Pak asep ud bagus tp kurang galak pak ngadepin yg berduit, , bertahun2 udah terjadi polusi di sana, .... karena banyak ngeles / silang pendapat nya,, padahal anak2 yg kena sakit kulit ud bnyak, blm pernapasan, ..ITU DIRUT KaCeN NGELES PINTER BANGET, sy yakin kluarganya jg gk ada yg mau dket2 daerah situ kalau emg tdk bahaya.",,,,,,,,,,,,,,,,,,,,,,,,,,,,,,,,,,,,,,,,,,,,,,,,,,,,,,,,,,,
2023-09-11,Makan tuh polusi,"Gara-gara pembangunan Indonesia terpusat di Jakarta, jadinya Jakarta padat, sesak, dan berpolusi....",,,,,,,,,,,,,,,,,,,,,,,,,,,,,,,,,,,,,,,,,,,,,,,,,,,,,,,,,,,,,
2023-09-12,"plta adalah energi bersih, pltu, pltd, pltn, semua energi kotor, penuh limbah dan biang polusi....kapan energi panas matahari, angin, panas bumi bisa menjadi sumber energi inti di indonesia,","Ky pabriknya kaido, mencemari lingkungan dan rakyat jd korban, siapa yg mendapat keuntungan???",,,,,,,,,,,,,,,,,,,,,,,,,,,,,,,,,,,,,,,,,,,,,,,,,,,,,,,,,,,,,
2023-09-13,"Cerdas, sudah dibahas Najwa shihab 1 tahun yg lalu. Tapi pemerintah tutup mata krn pabrik2 batubara cuannya besar apalg mau pemilu, buat MODAL anak2nya nyalon.",,,,,,,,,,,,,,,,,,,,,,,,,,,,,,,,,,,,,,,,,,,,,,,,,,,,,,,,,,,,,,
2023-09-14,"Polusi udara kan karna kita juga masyarakatnya, lagi pula membuat negara yang udaranya udah kotor bgt jadi tidak kotor kan butuh waktu lama dan kerja sama semua antar pihak. Kalau masih banyak kendaraan, pabrik, sampah dibakar, dll, gak ada gunanya semua penyelesaian selama bukan penyebabnya yang diatasi.",Itu PLTU di Bekasi juga meresahkan. Merusak lingkungan kala malam hari cerobong asap nya ngeri ngeluarin banyak POLUSI,,,,,,,,,,,,,,,,,,,,,,,,,,,,,,,,,,,,,,,,,,,,,,,,,,,,,,,,,,,,,
2023-09-15,Salah satu solusi mengurangi polusi udara di Jakarta adalah menerapkan tarif parkir yg mahal..tapi jadi dilema,"Jakarta Oh Jakarta....so sad, it is because the Government is not professional and too much corruption",,,,,,,,,,,,,,,,,,,,,,,,,,,,,,,,,,,,,,,,,,,,,,,,,,,,,,,,,,,,,
2023-09-17,"Selamat Mba najwa, sekarang sejakarta raya, sampe depok bukan cuma di marunda. Bisa lah di up lagi",,,,,,,,,,,,,,,,,,,,,,,,,,,,,,,,,,,,,,,,,,,,,,,,,,,,,,,,,,,,,,
2023-09-19,Bumi rusak ya karena ulah manusia itu sendiri.kalau dijakarta tidak bisa menghentikan polusi.pindah ibu kota di Kalimantan.lambat laun di Kalimantan jg akan ada polusi.padahal Kalimantan salah satu paru dunia.,aku baru tahu klo marunda banyak masalah itu tapi emang klo ke sana banyak debu,,,,,,,,,,,,,,,,,,,,,,,,,,,,,,,,,,,,,,,,,,,,,,,,,,,,,,,,,,,,,
2023-09-22,Sy merasa kasihan sm kalian org jkt...ckckck..,,,,,,,,,,,,,,,,,,,,,,,,,,,,,,,,,,,,,,,,,,,,,,,,,,,,,,,,,,,,,,
2023-09-23,"Indo semuanya nga bener Dari air bersih, polusi udara Sampah, limbah industry limbah manusia,.banjir. Jokodok malah bangun IKN Jokodok terbalik balik",,,,,,,,,,,,,,,,,,,,,,,,,,,,,,,,,,,,,,,,,,,,,,,,,,,,,,,,,,,,,,
2023-09-24,Yakin ini di jkt,"Kek gini yang disalahkan malah knalpot mobil, wakakakkakak, pabrik pabrik malah bebas",,,,,,,,,,,,,,,,,,,,,,,,,,,,,,,,,,,,,,,,,,,,,,,,,,,,,,,,,,,,,
2023-09-25,Kendaraan bermotor dijakarta sdah injeksi dan cdi pake catalytic converter semua mana bsa pembakaran ga sempurna .. kota besar lain di dunia jga masih pake kend ber bbm fosil dan ga polusi .... jgan sembarangan kasih statement ngawur pak,,,,,,,,,,,,,,,,,,,,,,,,,,,,,,,,,,,,,,,,,,,,,,,,,,,,,,,,,,,,,,
2023-09-28,"Perasaan selama ini polusi di Jakarta gak parah amat, sekarang sih amat parah, Ini mah supaya masyarakat Jakarta mau pindah ke IKN, makanya dibikin polusi",,,,,,,,,,,,,,,,,,,,,,,,,,,,,,,,,,,,,,,,,,,,,,,,,,,,,,,,,,,,,,
2023-09-29,solusi nya tolong para polisi koordinasi dalam peninjauan kualitasi emisi motor dan mobil yang berkeliaran di jkt,asap debu batubara bisa dikendalikan jika ada kemauan. bisa dinetralisir. hanya kemauan yg dituntut. mau tahu pengendaliannya seperti apa?,,,,,,,,,,,,,,,,,,,,,,,,,,,,,,,,,,,,,,,,,,,,,,,,,,,,,,,,,,,,,
2023-10-03,Wow jkt Prestasi bgt kualitas udara tidak sehat ke dua didunia .. sedangkan surabaya malah dpt predikat kuliner rawon sebagai sup terenak didunia ..,,,,,,,,,,,,,,,,,,,,,,,,,,,,,,,,,,,,,,,,,,,,,,,,,,,,,,,,,,,,,,
2023-10-06,"Masalah utama pemerintah Indon tidak adil itu saja, cukimai memang pemerintah Indonesia,, di jawa semua disana bangunan tinggi segala macam disana semua,, makanya polusi disana ,,",Percuma .....kl kampung kawasan bebas asap rokok kl di sebelah kampung nya tdk di larang knp kl orang bakar sampah di lingkungan yg dibilang kampung bebas asap rokok kok ga di larang aneh di Indonesia polusi udara sangat parah......kecuali hidup di desa.....yg bnr 2 bebas polusi udara. Ada sih ada tp sangat tipis bt di desa,,,,,,,,,,,,,,,,,,,,,,,,,,,,,,,,,,,,,,,,,,,,,,,,,,,,,,,,,,,,,
2023-10-15,"jakarta gak strategis jadi ibukota, semua sektor ditumpuk di jakarta solusi terbaik emang pindah ibukota",,,,,,,,,,,,,,,,,,,,,,,,,,,,,,,,,,,,,,,,,,,,,,,,,,,,,,,,,,,,,,
2023-10-26,"salah satu solusi saya untu mengurangi polusi udara Jakarta adalah menerapkan sistem penghijauan dan mengurangi penggunaan kendaraan sepeda motor atau mobil,dan biar lebih stabil seharusnya kita menggunakan sepeda atau jalan kaki agar dapat mengurangi polusi secara cepat",,,,,,,,,,,,,,,,,,,,,,,,,,,,,,,,,,,,,,,,,,,,,,,,,,,,,,,,,,,,,,
