2023-08-14,langit nggak terlihat hanya asap doang,Siap-siap untuk wajib dibeli oleh masyarakat di jakarta suatu produk yang harus dipakai untuk mengurangi polusi yang sedang dikampanyekan ini,Polusi udara solusinya bukan jalur sepeda tapi IKN yang promo IKN menang banyak nih,Polusi jakarta sama macet mah gampang ilanginnya... Sebar Corona virus...aja jakarta itu ibarat pasar tradisional.... Kalo mau di buat modern gampang... Pemerintah kerja yg lebih keras lagi...bisa kan tinggal ngutang....,"Ikutin Jepang 5 tahun sekali giling motor pakai duit sendiri. Pajak kendaraan naikin biar naik kendaraan umum. Tutup urbanisasi tambahan agar tidak ada lagi pendatang yang pindah ke jakarta karena sudah sangat melewati batas. 1KK 1 kendaraan, ini bisa ngelarin tapi mafia pemerintah ga bakal biarin minyaknya nganggur.",Anies yang akan atasi polisi udara di jakarta pasti bisa...caranya semua transportasi harus dimogokkan total...ganti dengan alat transportasi utama yaitu.... KAKI,"Harusnya jkt bebas polusi, doktor yohanes anis sudah berjuang keras menanam patung bambu esek2 kebanggaan bani petamburan.","sudah dibilang kalau IKN itu dibuat karna di jakarta dan jawa sudah over populated, tanah air dan udara sudah gak sanggup menopang populasi.",Polusi udara tidak lah seberapa atau bukan paling buruk di dunia silakan admin Kompas TV cek kota mumbai di india dan kota banglades dan juga kota Lahor di pakistan mereka sangat2 lah buruk dan bisa di bilang terburuk di dunia,"Semua masyarakat harus peduli dengan polusi ini,kurangi kend.pribadi gunakan fasilitas angkutan umum",Industri berkontrubusi besar terhadap polusi udara,"CAPRES SI BLOON ITU SEBUT KENDRAAN LISTRIK LEBIH BANYAK MENIMBULKAN POLUSI,, Tapi Banyak ahli ahli Sebut pengunaan kendaraan listrik mengurangi POLUSI",Koq masih pada betah tinggal di jakarta sangst tidak layak huni,Prestasi Heru Budi yg mendunia... No 1 tertinggi di dunia polusinya...,Udara kotor jakarra ini Isue sesat biar pindah ke IKN,Biasanya Anies yg di salahkan. Wktu pa anies jakarta udara sdh sehat solusiinya .si Heru sam jokowi tanya aja sm pa Aniess.....!!!,Isue udara kotor jakarta Biar pindah kw IKN.....????,Hari ni udara buruk hari ini di suruh nanem pohon sedia payung pak sblm hujan,sejak jaman metromini jugak polusi jakarta dah buruk atuh...,"Dulu jamannya Pak yg kemaren kualitas udara Jakarta bagus,,cepet amat skrg langsung buruk..","Yaaa gara garaa,,,,,pejabatnya maruk harta,,,,mikirrrr,,,,mikirrrr,,,,coba,,,,bedain,thn 80 smpi 90an,,,,,loe org yg nebangin,,,masyarakat yg loe suruh,,nanam,,loe yg dpt untung,,,masyarakat yg buntung,,,,tolollllllllllll","Sayangnya banyak yg tdk peduli, dua minggu lalu saya jalan di CFD dan saat dekat ke Semanggi hidung saya gatal2, jadi saya pakai masker, eh ada bapak2 yg sinis ngomong yg kita hirup udara, bukan air , mo marah susah, masa mo marah ma org yg senang menghirup udara berpolusi, so sak karepmu dewek lah, saya pilih pakai masker aja klo outdoor. Buat gub jkt masy jkt mo nanam pohon di mana pak? Rumah udh ga ada halamannya.. asbun aja klo ngomong",Tanamin pohon cemara aja di tiao2 trotoar yg lebar... Pohon cemara bikin sejuk tuh... Atau bagi area jalan yg di tengah2 nya ad trotoar lebar Tananin tanaman obat segala jenis khasiat.. Trs bs di petik gratis dan Supaya warga Jakarta bs slalu menjaga kesehatan nya ketika jkt lg darurat polusi udara...,"SEBAIK,,,NYA,,,ORANG,,,,JAKARTA,,HARUS,,,,PINDAH,,DARI ,JAKARTA,,,,,DAN,,,PERUSAHAA,,,,,YG,,ADA,,DI,JAKARTA,,,,,HARUS,,,PINDAH,,,,,SUDAH,,,PADAT,,,,PENDUDUK,,,NYA,,,,,,DI,,PINDAH,,KAN,,,KE,,,KALIMANTAN,,,ATAU,,,,,SUMATRA,,,,,,SULSWESI,,,,,",Jakarta polusi efek pembangunan ikn bener ga sih analisa saya? Kan kalimantan paru2 dunia,ASAP ROKOK NGARUH KAGAK? KALAU NGARUH COBA BIKIN KEBIJAKAN 1 HARI TANPA KOREK,Pembangunan doangan pohon pohonnya di babat habis .... Rimbunin pepohonon dong biar hijau jakarta,"WFH nya harus jangka panjang sih, klo bentaran doang nanti begitu udaranya udah bersih pada WFO lagi banyak kendaraan bermotor keluyuran di jalanan lagi malah bisa naik parah lagi polusinya seperti yang terjadi sekarang. Tolong perhatikan juga anak2 di sekolah swasta elit yg diantar jemput kendaraan pribadi (mereka juga salah satu penyebab padatnya kendaraan di jalanan jakarta, terbukti pas lagi liburan kemarin jalanan jakarta jadi berkurang macetnya).","CAPRES SI BLOON ITU SEBUT KENDRAAN LISTRIK LEBIH BANYAK MENIMBULKAN POLUSI,, Tapi Banyak Sebut kendaraan listrik mengurangi POLUSI",kok ga pabrik yg dicek?,Gw tanam Pohon.. tapi Bukan di Jkt...,Dan sekarang terbukti polusi di jakarta yang sedang kita rasakan belakangan ini (,Makanya jangan xxxxdoang yang dkeruk kruk juga tuh polusi lbh baik kruk air atau polusi....mana yang lbh priortas kshtn atau bnjir yng hanya 1th skli,"Sungainya udh bersih,,, kini udaranya pula tercemar....",Kurangi pabrik kendaraan tanam pohon sebanyak banyak,"Wong yg pny mobil jg merajalela,, motor aplg.. Ky d luar sna donk tarif parkir berkali Lipat jd mrka yg mw bli mobil jg mikir buat parkir mahal mnding gunain fasilitas negara ngono... Tz mikrolet apb d fullin jaklingko Pak biar yg rakyat kcil pd demen naik angkot drpd pny kndraan sndri. Terus...... Jgn diribetin lah klo mw naik busway, ky zaman dlu z biar g ribet,, q mw naik busway ribet jd naik grab dh . Naik kreta jg murah cma 3rb ud muter Jkt",Gedung doang gede gede pohon gak ada atau jarang jarang .... di wajibkan seiap gedung atau hotel minim pohonannya Ratusan bibit pohon ... Sampah daun kalau di bakar itu jadi herbal dibanding sampah plastik dan asap kendaraan menjadi Racun dan penyakit di tubuh,"kurangin pohon , banyakin nanem gedung bertingkat pasti cepet","Pangilmbk rara aja suruh datangin ujan, sama ac",Bikin hujan buatan aja ngapain susah 2,Jakarta polusi efek dari pembangunan ikn bener ga sih analisa saya? Kan kalimantan paru2 dunia piye seh,"CAPRES SI BLOON ITU SEBUT KENDRAAN LISTRIK LEBIH BANYAK MENIMBULKAN POLUSI,, DI YOUTUBE INI SEBUT KENDRAAN LISTRIK MENGURANGI POLUSI",pesawat penyedot asap bos solusinya......minta doraemon,Waktu p anis mnjabat-jojo ga ikut cmpur masalah polusi- p Anis bisa menyelsaikn nya,Ditinggal Anies polusi lagi,"Ganjil genap niat nya buat ngurangin polusi, eh malah bnyak yg beli kendaraan dua supaya bisa tiap hati pakai kendaraan pribadi","ingat ya itu info polusi bukan virus covid varian eris. klo virus covid di besar2 kan, trus dipaksa vaksin, bacok kepala tukang suntik!!!!!!!","Motor banyak banget,apalagi ojek. Maksimalkan akomodasi transportasi di jakarta (Bus dan angkot)Karena banyak jalur yang tidak ada transportasi publiknya.",Polusi nya dari kalbar itu.gitu aja kok pake dirapatkan,"JAKARTA SEMAKIN PENGAB,KARENA FIRUS PENDUKUNG CAPRES SALING MEMANAS.MAKANYA JANGAN CAWE OOM.....,BAHAYA","Saya mohon pada DPR pemerintah atau yang berjuang menenggakan naszakom atau kaptaIiz, untuk memberikan tekanan pada PNS LAPAN dan BMKG, karena ini adalah Akir zaman bukan waktunya santai. Apakah kalian ingin menjadi korban juga akibat kelalaian tidak profesional, lambat dan kurang transparansi instansi ini. Hai kamu jgn enak enak jadi PNS makan uang rakyat yang belom tentu ridho dan hidupmu pasti tidak akan nyaman memakan uang kami.. Tolong diulas Apakah HAARP itu memang ada dan nyata? Jika memang ada kenapa tidak ada Hukum yang mengatur senjata pemusnah masal ini mengenai bentuk teknologi serta pengoperasiannya secara Pseudo-Science? Jika memang Haarp itu tidak ada kenapa seorang DR. Begich Politisi Alaska tempat HAARP itu dibangun sekaligus juga dosen, dia menulis dalam bukunya berjudul Angels Don t Play This HAARP , Menyatakan keberadaan mengenai senjata ini? Kemudian pemimpin Venezuela Huge Chavez mengklaim bahwa HAARP atau program sejenis memicu gempa Haiti tahun 2010 disebabkan oleh sesar patahan yang sebelumnya tidak terpetakan di sepanjang perbatasan lempeng tektonik Karibia dan Amerika Utara? Apakah kebangkitan Ring of Fire dunia dari gempa, gunung meletus secara serentak, robeknya lapisan atmosfer ionosfer akibatnya meteor muda masuk ke bumi, kemudian berbatai dentuman dibeberapa tahun terakhir, kemudian cuaca El nino, dan berbagai macam peristiwa alam tidak wajar ini diakibatkan oleh senjata masal ini.? Tolong jawab hoe pns lapan BMKG.. jangan diem",Rekayasa hujan buatan. Paling tepat pindah aja,"Kalau GUBENURNYA CUMA TITIPAN YA BEGINI HASILNYA !!! SAMPAI DIRAPATKAN DIISTANA DAN DIPIMPIN OLEH SI IJAZAH PALSU ALIAS DUNGU RENCANA BEDA DENGAN GUBENUR YG PURNA TUGAS KEMARIN PAK ANIES, MALAH BISA MENURUNKAN TINGKAT POLUSI WALAUPUN HANYA SINGLE FIGTHER",,,,,,,,,,
2023-08-15,polutan yg memroduksi juga kalian..jadi mamam tuh polusi,Ketika Anies Gub Dki. Udara jkt kotor buzer lapor polisi. Skrg mana laporannye...broo. HERU apa aja kerjaanya.,"infrastrukturnya uda kacau dari awal jadi susah dibenerin n serba salah, mau naik kendaraan pribadi macet dimana2 karena konstruksi jalan yg ga bener akibatnya bikin polusi udara, mau naik kendaraan umum ga nyaman banyak copet, pelecehan apalagi kalo malem agak serem, blom lagi tempelan ama org miskin badannya bau... paling solusinya terapin ganjil genap sepanjang hari termasuk hari libur, melakukan hukuman mati pada orang yg pake kendaraan asapnya ngepul, dan subsidi mobil2 dan motor listrik","Polusi ini mah warisan Anies.. Heru mmg luarr biasa, liat saja, dlm waktu 1 bln kedepan, udara jkt akan jd no.1 terbersih di dunia..","bener sih kata bg yosep harusnya jika ingin masyarakat tidak menggunakan kendaraan pribadi harusnya kendaraan umumnya yg dibenahi, sebaliknya polusi di Jakarta malah pengendara yg jadi kambing hitam, padahal kalau kesejahteraan merata dan mudahnya akses2 kendaraan umum masyarakat pasti memilih kendaraan umum..",Mau beralih ke PLTN kabar baiknya kualitas udara semakin jauh membaik atau tetap menggunakan PLTU yang bahan bakarnya dari Batubara?. Kalau orang yang peduli dengan kesehatan pasti jawabnya yang banyak manfaatnya daripada mudhorotnya.,"Arah angin dr barat ke timur, PLT batubara menghasilkan banyak polusi...kalo masalah kendaraan,,dr kemaren jg jkt udh padat kendaraan bermotor.",Itu yg kemaren nebangin banyak pohon di sekitar Monas gmn ya nggak mikir apa?,"Karena pergerakan ekonomi yang ada di Indonesia hanya terpusat dikota tertentu saja,itu yang menyebabkan polusi terjadi karena ketidak seimbangan itu",Ada pabrik2 besar dan PLT dengan batubara di Banten/Serang. Kemungkinan asap polusi nya mengarah ke Selatan yaitu Jakarta dll. Perlu evaluasi yg serius dari yg berwenang.,Assalamualaikum warahmatullahi wabarokatu wilujeng enjin bagaimana Bu Mentri tentang limbah yang di buang ke laut dekat pembakaran mayat di daerah muara tawar sering say memancing ikan limbah yang di buang Kel laut air walaupun sudah di saring tapi bau air nya juga panas menimbulkan bau tidak sedap dan ada juga di daerah Babelan melalui sungai atau kali bekasi ujung muara yaitu kali CI B L ada industri batu bara.semunya berada di wilayah Utara Bekasi kec.tarumajaya.dan muara tawar juga masuk wilayah desa Sagara jaya.dan disitu juga ada dua tokoh partai dari anggota DPR dari PDI dan Sekarang saya survei ada perwakilan dari partai Nasdem ini dari dulu sampai selalulah keluarga besar nya semoga Nasdem yang akan berjuang di Sagara jaya jangan ada money politik seperti PDI saya dulu jualan es kelapa di depan gapura arhanud sekarang jadi warteg nasi.saya 10 tahun tinggal di sana dan saya sebagai saksi dan saya pernah di lalui oleh presiden SBY dan ibu Ani Yudhoyono melintasi jalan ketika seluruh Jakarta banjir besar termasuk Bekasi.. Utara presiden SBY sempat meninjau masyarakat yang terkena musibah banjir dan membagikan sembako Mei instansi untuk warga yang terkena banjir Alhamdulillah saya dapat dari Demokrat walupun 5 bungkus ini fakta silahkan tanyakan beliau mantan presiden SBY.,"Jakarta itu harus jadi tata kota yg syarat infrastruktur transportasi merata tidak hanya di distric tertentu, dan penghijauan yg merata dan massive","Penduduk jakarta itu sudah over kapasitas, setiap tahun ratusan ribu orng masuk ke Jakarta untuk merantau adu nasib dan sebagainya bahkan mereka yang pendatang ada yg stay permanent atau menjadi warga jkt tetap, udah gtu lahan terbuka hijau di jkt kurang dan orng di sana lebih suka pakai kendaraan pribadi ntah montor atau mobil. Solusi nya adalah bangun Sentral ekonomi di luar jakarta kota kota besar lainnya juga harus di perhatikan untuk meminimalisir perantau yg akan datang ke jakt karna jakt udah bener bener padet, masa luas 661km jumlah penduduk 11juta di tambah daerah sekitar jakarta yg masyarakat kerja nya di jakarta.","Polusi karena jakarta di kelilingi tol. Dari jawa mau ke sumatera lewat jakarta. Pemda jakarta,bekasi,tanggerang beli lahan buat taman kota","pindah ke dusun saja, itupun kalo mau... disini udaranya sehat, sejuk, bebas macet dan polusi, tapi ya gitu pendapatannya gak sebesar jakarta.","Kenapa pemerintah yg salah lagi nih? Kita sendiri hrs sadar saja - Kurangi rokok, kurangi emisi kendaraan, kurangi penggunaan ac, kurangi pembakaran sampah, kurangi yang bersifat polusi udara, tanaman hijau diperbanyak Dan sorri kenapa mesti ingat covid??? Apa kaitan dgn covid??","Saya sangat salut warga jakarta kuat dengan polusi seperti ini, saya aja 5 hari ga kuat di sana... Semangat warga jakarta kalian luar biasa","POLUSI UDARA di jakarta 1 ..KEBAKARAN 80% ( perumahan,kios,pabrik,kantor) 2.. Asap PABRIK 10 % 3..RUMAH MAKAN KANTIN warung 8 % ( jenis makanan bakar ) 4.. Kendaraan ..2 % Cek secara logika,,,,hujan gak ada ASAP SULIT UNTUK HILANG,,,, GAS EMISI CEPAT HILANG,,SEPERTi kentut",ITU AKIBATNYA POHON2 DIMONAS DITEBANGIN SAMA ANIES...TDK ADA PARU2 KOTA..YG MERUBAH CO2 JADI O2...ANIS PEKOK,"Walah Gawat darurat, di rasakan begitu memang setiap saat seperti berkabut tapi sesungguhnya itu polusi udara, yang jalanan sangat macet parah di mana mana, galakan WFH lagi bagi yg bisa wfh salah satu cara mengatasinya...",Surabaya tetap sehat.kan ga ada rencanapindah sursbaya. Jkrt banyak isu menakut2i.banjir sunami longsor macet ambles.tapi urban dari tionkokian banyak sudah mencapai .20%.,- integrasi transportasi umum harus dikembangkan utk mengundang orang memakai transportasi umum - menerapkan system WFH di setiap hari Rabu utk mengurangi mobilitas transportasi pribadi. - harus juga di pikirkan jalan lain nya utk driver online pada saat penerapan WFH,sampai kapanpun siapapun pemimpinya JKT akan tetap polusi slama penggunaan bahan bakar fosil masih dipake untuk kendaraan dan industri...sudah pindahkan saja ke IKN itupun hanya mengurangi tingkat polusi JKT tidak menyelsaikan persoalan,"Solusinya harus punya orang2 pintar, sayangnya tdk ada orang2nya. Harus segera Audit kualitas BBM yg digunakan yg dijual unt kendaraan sudah memenuhi standard polusi yg menimbulkan residu gas buang, kendaraan sekarang sudah injection ,apakah BBM yg disuply pemerintah/pertamina yg monopoli sudah standard?. Audit Dephub unt kir kendaraan apakah benar2 di kir dng benar, terutama truck yg menggunakan solar yg asapnya hitam. Audit Dep Perindustrian unt kontrol industri yg tdk menggunakan dust collector (penyaring debu dan polusi) apakah sudah diterapkan? Jangan disalahkan masyarakat yg menggunakan kendaraan yg mereka penggerak petekonomian. Mikir mikir jangan sibuk cawe cawe, sudah begini kebakaran jenggot, kesannya seperti tukang tahu bulat dadakan","Pak Anis ngak Jadi Gubernur DKI Lagi, Polusi Kendaraan Meningkat di Jakarta","sumber terbesar polusi udara itu adalah Kendaraan berbahan bakar, itu menyumbang skitar 65% sampai 75% polusi udara di perkotaan. jadi solusi untuk itu yaitu Kendaraan Listrik. dan Pln tenaga surya (plts) juga akan di bangun di indonesia dalam skala besar dalam bbrp tahun ke depan. kendaraan listrik juga enak minim perawatan.",ASAP dari PLTU bossss,Saya suka naik KRL tp sejak jadwal baru jadi malas.. karena telat teruss.. naik Transjakarta jg bgt antrian untuk transit sangat lama,"seharusnya cepat bertindak..gedung2 bertingkat, terutama rumah sakit ,menyembrotkan air berkabut ke udara.agar kabut melekat pada air,sehingga udara cerah.",Jakarta nasibmu kini. Ditangani org yg gagal paham menejemen perkotaan. Heru gak nyampe... Mikirnye,Ini yg bikin polusi tambah parah angin laut masuk kekota,"Saya di jkt timur,kulit gatal dan batuk sekeluarga,,apa ini dampak pulosi udara dr polusi batubara..","sekarang lagi hot lagi, apakah sudah ada perbaikan dan ada perkembangan? melihat polusi udara yang terjadi saat ini?","Ahh warga dki jakarta lebih mencintai harta dan teknologi, daripada budaya dan lingkungan",,,,,,,,,,,,,,,,,,,,,,,,,,,,,
2023-08-16,"KOMPAK bgt ya Tv tv rezim,, yg disalahin Kendaraan,, padahal 3 PLTU dibanten lah yg menyebabkan polusi gila2an udara jakarta Depok","Sedih banget Jakarta jadi balik ke jaman dulu. Ini salah satu alasan aku ga mau tinggal lagi di Jakarta 14 tahun lalu. Tiap kali liburan ke Jkt, seneng krn polusi semakin sedikit sejak ada MRT. Sedih sekarang balik lagi jadi banyak polusi","Jakarta setelah masa kepemimpinan Pak Anis amburadu, semrawut, ruwet",Asap itu dimasukan ke tanah bukan di arahkan kegorong Raksasa kelalut... Melawan sunatuwlah..,"Solusi nya jakarta WFH, kurangi kendaraan dan PLTU itu kalo bisa ditutup aja","Ada aja gol sebelah selalu mencari cari bgm cara menjelekkan pemerintah yang sekarang, soal polusi itu kan tanggung jawab kita semua. Coba telaah pakai otak sehat","Gak papa tah, yang penting jakarta banyak mall didalamnya udara bersih dan segar",Polusi itu buatan dr manusia ... Klo ga mau polusi ... Jgn menyebab kan polusi...,Knp baru sekarang ya dibikin berkabut langitnya? Tahun2 kemarin biasa aja. Apa buat alasan jualan kendaraan listrik ya? Atau alasan ikn?,JEPANG DAN CINA BERASIL NGIRIM LIMBAH POLUSI KE INDONESIA...,"Di tinggal anies jakarta jadi amburadul,,,",Hapus bio solar harus pakai ultra low sulfur. PLT Gubernur ayo ambil kebijakan kenapa waktu pak Anis udara di Jakarta berada di level yg baik.,"Sy bingung 90% org indonesia masih kira polusi itu dari kendaraan. Polusi dari kendaraan hanya sekitar 5-10%. 90% polusi itu dari pembakaran batu bara di pltu. Pltu itu suplai listrik ke mall, office dan perumahan. Dan paling besar supply energy ke pabrik2 besar. Dan pabrik sendiri juga ada pembakaran. Kenapa waktu lockdown udara membaik ? Karena office mall dan pabrik2 semua pada tutup. Jadi pembakaran di PLtU turun drastis",sekarang lagi ramai bicara tentang pencemaran udara terus inget setahun lalu pernah nonton SD di jakarta yang sangat sanget berdebu ternyata di narasi,"Masukan ni pak, mudah2an baca komen 1. Pajak motor naikan 500%, cc motor di bawah 350 cc di hilangkan. 2. Parkiran di kantor2 jadikan taman 3. Undang2 lalulintas terapkan 100% 4. Anak sekolah masuk jam 9 pagi dan di larang membawa motor, seperti tahun 80an 5. sosialisasi menggunakan transportasi umum. 6. Kalau masih bingung juga tanya pak Anies, malu bertanya polusi nambah",,,,,,,,,,,,,,,,,,,,,,,,,,,,,,,,,,,,,,,,,,,,,,,,
2023-08-17,baru aja polusi berkurang saat covid tampaknya memang covid adalah obat untuk bumi dan penyakit untuk manusia,Ditangani heru DKI Parah polusi udara,Emang iya dengan tidak melakukan apa-apa polusi akan hilang dg sendirinya?,Wajarlah Jakarta tingkat polusinya tinggi namanya juga tempat sampah berkumpul dari pencuri kelas teri sampai pencuri berdasi kelas kakap jadi satu semoga saja polusinya nggak turun2 biar sampah2 itu pada mati,Udara timur indonesia lebih sehat dari pada udara jakarta,Tambah bencana tahun 2050 jakarta tenggelam,Ayo viral kan lagi krn skr jkt tambah parah polusinya,"Seharusnya Singapura dan kota yang lebih besar lainnya di eropa, Amerika lebih parah polusinya klw disebabkan gedung pencakar langit.",,,,,,,,,,,,,,,,,,,,,,,,,,,,,,,,,,,,,,,,,,,,,,,,,,,,,,,
2023-08-18,"bagimana gak polusi udara kurang bagus di jakarta, kurang nya pembangunan penghijauan kota seperti taman, dan pembuatan hutan , jangan salahin kendaraan , sadar diri kita aja pikir penghijauan dikota jakarta kurang, pemimpin sibuk buat yang kurang manfaat","Cerobong pabrik diwajibkan pakai exh gas scruber, jadi asap cerobong asapnya disemprot pakai air untuk mengurangi timbal dan carbon kemudian asap yang bersih dilepaskan ke udara, seperti seperti dikapal itu lo. Jangan kendaraan orang kecil yang di jadikan alasan terus.",Tolong dicheck pabrik yang menggunakan batubara ...penerintah harus tegas,Solusinya Pake tabung bulat buat nyelam kayak di Tom Jerry,"Adakah konektifitasnya, diantara polusi, polis/kota besar/Wahyu 17 18, ...roh-roh jahat di udara.. dan Indonesia Beautiful City , ucap Nadine di acara Miss Universe?","Tutup pabrik2, mobil/motor diganti sepeda sama kuda... Hidup seperti Tarzan manusia goa... TAPI DI MIMPI",Para elit bagi2 cuan. Rakyat dapat debu.,"jangan salahin pemerintah dana kendaraan, di jakarta penghijauan kurang dan hutan kota di jakarta kurang",Beginilah kalau pjs tidak melanjutkan program pak anies dg program langit birunya dulu jaman pak anies jakarta sejajar dg kota kota di dunia sekarang juara polusu tingkat internasional,Tolong check pabrik yang menggunakan batubara,,,,,,,,,,,,,,,,,,,,,,,,,,,,,,,,,,,,,,,,,,,,,,,,,,,,,
2023-08-19,"Pribadi saya lebih mendorong pemerintah mensubsidi PLTS solar panel rumahan daripada EV, ini akan sangat mentransformasi banget tapi akan sangat merugikan lingkaran PLN khususnya mafia Batubara. Tapi kalo ini sukses beralih masif di terapkan di pemukinan JABODETABEK , dengan teknologi PLTS hybrid rumahan PLN yaitu kompensasi kelebihan listrik yang diproduksi tidak terpakai rumahan dapat diekspor ke PLN (kita dibayar) mungkin menjadi solusi untuk penggunaan listrik yang dibutuhkan industri pabrik dll. Semoga PLTU Batubara bisa ditutup SEGERA !","Saya dari NTT yg biasa udara segar, masuk ke JKT lgsg berasa di hidung dan tenggorokan. Smga JKT bisa membaik udaranya.","NIKUBA solusinya, alat merubah air jadi HYDROGEN /BBM, tanpa polusi, udara bersih lihat di youtube, negara bisa hemat BBM ratusan trilun, gak perlu import minyak lagi","Kenapa juga ada kebijakan becak dilarang, padahal di negara maju masih banyak kendaran ramah polusi dan jalur aman untuk pejalan kaki ini pasti salahnya pada banyaknya kendaraan pribadi.",Berkaca 3 tahun lalu saat PPKM udara Jakarta bersih,Cuaca memang sedang buruk. Sudah beberapa hari tidak turun hujan. Jadi debu beterbangan karena aktifitas manusia,"Usul saya agar pabrik besar ditutup dipindahkan kekota diluar Jawa jangan semua difokuskan di Jawa termasuk kantor2 kementrian, kantor pusat BUMN, penggunaan kendaraan pribadi ditiadakan, pajak parkir dinaikan setinggi-tingginya permenit Rp 10rb angkutan masyarakat yg ada hanya kendaraan angkutan umum, batasi penjualan kendaraan, ruang hijau diperluas secara besar2an. Bila tidak maka IKN kalimantan solusinya.",,,,,,,,,,,,,,,,,,,,,,,,,,,,,,,,,,,,,,,,,,,,,,,,,,,,,,,,
2023-08-20,"tahun 2012 gunung kelut meletus.... jarak jogja kediri sekitar 300 km, ehhh abunya sampai genting aku berkilo kilo ...... kok kamu heran ... dengan polusi PLTU",Kembangin pltn,"Kalau ibukotanya sudah pindah,...otomatis polusi udara Jakarta akan berkurang. Itulah solusi satu nya....untuk mengatasinya. Semoga disegerakan.",Mendadak sekarang pada sadar lingkungan.. Coba pak anies masih gubernur pasti jadi salahnya pak anies gx becus mimpin jakarta.. Heee.. Kalo sekarang...??? Gx mungkin nyalahin pejabatnya.. Semua mendadak mikirin lingkungan.. Hee,angin laut bukan air laut,"itu karna musim kemarau tiba. air laut ke darat jadi pertemuan dingin seakan menjadi kabut. masalah batuk air laut yg mengandung garam. itu kalu hujan turun pasti bersih, itu pendapat saya",Apakah karena ini juga polusi di Jakarta sekarang semakin parah??,Disegrakan pembatasan usia kendaraan yg beroprasi di ibu kota jakarta.minimal 10 thn nga bole ditawar2 lagi jika jkarta terbantu dari polusi,,,,,,,,,,,,,,,,,,,,,,,,,,,,,,,,,,,,,,,,,,,,,,,,,,,,,,,
2023-08-21,DI TINGGAL PAK.ANIS JAKARTA POLUSI TERBURUK SE DUNIA,"Pemilik pltu mestinya wajib pasang filter di cerobongnya dan dirawat tuh cerobong, atau ya permudah masyarakat utk pelaporan atas polusi dari cerobong pabrik",Harusnya jangka panjang segera dibangun Solar power plant dan Wind power plant agar menunjang green ecology enviroment dan polusi,"ujung2nya asap klanpot yg d salahkan, n jd alesan pmrintah biar semua kndaraan pk tenaga listrik pdhal utk mmbngkitkan turbin jg hrs pk bbm fosil. jd ini cm mmindahkan polusi dr kota k hutan",Kendaraan mobil dan motor di kurangin mengurangi polusi dgn naik sepeda dan jalan kaki,"Produk apa lg yg akan masuk dan membanjiri indonesia,sepeda listrik,motor listrik,atau kendaraan lain yg tidak menggunakan bahan bakar...?","Gila gila ,perasaan tahun 2015 lalu saya di jakarta masih mudah lihat langit biru dan bintang di malam hari, tapi sepertinya saat ini sudah mustahil",Minta Di..Kirimin Rudal Nuklir Sama Pak..De...Putin...Di..5..wilayah JKT buat mengurangi ..mobil... ...motor...dihajarnya .dihari kerja ya...lagi..pada ngumpul .di .Jakarta..dicoba aja dulu....ya....mksh.,Jadi mau pindah ibu kota jakarta ke hutan pembangunan pembangunan tuh lihat di Indonesia rakyatnya semakin menderita berbagai kejahatanlah semakin membabi dan kehinaan Kemiskinan dan Pengangguran dan gempa bumi dan musibah lainnya tidak ada henti-hentinya di karenakan sebagian besar manusianya menentang keras kepada ALLAH SWT dan Rosul-RosulNYA dan menentang keras untuk terlaksananya syari at Islam secara keseluruhan yang ada dalam firman ALLAH SWT yaitu Al-Qur an dan hukum Pidana ALLAH SWT atau hukum Qisas supaya ada efek jera pada seluruh manusia dan rakyatnya menjadi aman dan nyaman sentosa kaya raya sejahtera di jamin keamanan dan keperluan hidupnya selamanya janji ALLAH SWT paling benar dan nyata atau bertobatlah pada ALLAH SWT dan kembali ke agama Islam yang secara keseluruhan,Hahahahaha parah astaghfirullah bnyk orgorg parah dijakarta,"JAKARTA, INDONESIA",Mobil listrik nambah macet dan polusi kendaraan,"pabrik kecil di suru pindah dari jakarta, eh malah bakar batubara di jakarta.. sekarang jakarta polusi no 1 di dunia..",,,,,,,,,,,,,,,,,,,,,,,,,,,,,,,,,,,,,,,,,,,,,,,,,,
